<?xml version="1.0" encoding="utf-8"?>
<!DOCTYPE mythuitheme SYSTEM "../mythuitheme.dtd">
<mythuitheme>

    <window name="rawsettingseditor">
        <textarea name="heading" from="basetextarea">
            <area>20,20,760,40</area>
            <align>allcenter</align>
            <font>basemedium</font>
        </textarea>

        <buttonlist name="settings" from="basebuttonlist">
            <area>20,80,400,320</area>
            <layout>vertical</layout>
            <spacing>5</spacing>
            <scrollstyle>free</scrollstyle>
            <wrapstyle>none</wrapstyle>
            <buttonarea>0,0,400,300</buttonarea>
        </buttonlist>

        <shape name="label-shape">
            <area>20,420,400,30</area>
            <type>roundbox</type>
            <fill color="#000000" alpha="130" />
            <cornerradius>4</cornerradius>
        </shape>

        <textarea name="label-text">
            <area>24,420,392,30</area>
            <font>basesmallgreen</font>
            <align>left,vcenter</align>
        </textarea>

        <shape name="background">
            <area>20,455,760,30</area>
            <type>roundbox</type>
            <fill color="#FFFFFF" />
            <cornerradius>4</cornerradius>
        </shape>

        <textedit name="settingvalue">
            <area>24,455,760,30</area>
            <imagetype name="cursor">
                <filename>cursor.png</filename>
            </imagetype>
            <textarea name="text">
                <area>5,0,750,30</area>
                <font>basesmallblack</font>
            </textarea>
        </textedit>

        <button name="cancel" from="basebutton">
            <position>20,540</position>
            <value>Cancel</value>
        </button>
    
        <button name="save" from="basebutton">
            <position>630,540</position>
            <value>Save</value>
        </button>

    </window>

</mythuitheme>
