<?xml version="1.0" encoding="utf-8"?>
<!DOCTYPE mythuitheme SYSTEM "http://www.mythtv.org/schema/mythuitheme.dtd">
<mythuitheme>

    <window name="gallery">

        <!-- optional - shows current image name -->
        <textarea name="title" from="basetextarea">
            <area>15,20,500,50</area>
            <cutdown>yes</cutdown>
            <font>baselarge</font>
        </textarea>

        <!-- optional - shows path to current image -->
<!--    <textarea name="breadcrumbs" from="basetextarea">
            <area>70,15,460,30</area>
            <font>basemedium</font>
            <align>left,vcenter</align>
        </textarea>
-->
        <buttonlist name="images">
            <area>15,0,770,585</area>
            <layout>grid</layout>
            <spacing>5</spacing>
            <buttonarea>0,65,770,520</buttonarea>
            <statetype name="buttonitem">
                <area>0,0,150,125</area>
                <state name="active">
                    <imagetype name="buttonbackground">
                        <filename>shared/grid_back_reg.png</filename>
                    </imagetype>
                    <imagetype name="buttonimage">
                        <area>10,8,130,90</area>
                        <preserveaspect>true</preserveaspect>
                        <filename>shared/grid_noimage.png</filename>
                    </imagetype>
                    <statetype name="nodetype">
                        <position>80,55</position>
                        <state name="subfolder">
                            <imagetype name="icon">
                                <area>0,0,50,50</area>
                                <filename>shared/directory.png</filename>
                                <preserveaspect>yes</preserveaspect>
                            </imagetype>
                        </state>
                        <state name="upfolder">
                            <imagetype name="icon">
                                <area>0,0,50,50</area>
                                <filename>shared/updirectory.png</filename>
                                <preserveaspect>yes</preserveaspect>
                            </imagetype>
                        </state>
                    </statetype>
                    <textarea name="buttontext">
                        <area>5,98,140,25</area>
                        <font>menufont</font>
                        <align>hcenter,bottom</align>
                    </textarea>
                    <textarea name="childcount" from="basetextarea">
                        <area>65,72,55,20</area>
                        <font>basesmallblack</font>
                        <align>right</align>
                    </textarea>
                    <statetype name="buttoncheck">
                        <position>130,105</position>
                        <showempty>yes</showempty>
                        <state type="full">
                            <imagetype name="marked">
                                <filename>gallery-mark.png</filename>
                            </imagetype>
                        </state>
                    </statetype>
                </state>
                <state name="selectedactive" from="active">
                    <imagetype name="buttonbackground">
                        <filename>shared/grid_back_sel.png</filename>
                    </imagetype>
                </state>
            </statetype>
            <statetype name="upscrollarrow">
                <position>640,20</position>
                <showempty>yes</showempty>
                <state type="full">
                    <imagetype name="upon">
                        <filename>up_arrow.png</filename>
                    </imagetype>
                </state>
            </statetype>
            <statetype name="downscrollarrow">
                <position>700,20</position>
                <showempty>yes</showempty>
                <state type="full">
                    <imagetype name="dnon">
                        <filename>down_arrow.png</filename>
                    </imagetype>
                </state>
            </statetype>
        </buttonlist>

        <textarea name="position" from="basetextarea">
            <area>530,15,110,40</area>
            <align>hcenter,vcenter</align>
            <font>basemedium</font>
        </textarea>

        <!-- optional - shows a message when no images are available
             in the current directory -->
        <textarea name="noimages" from="basetextarea">
            <area>15,20,770,560</area>
            <font>basemedium</font>
            <align>allcenter</align>
        </textarea>
    </window>

    <window name="filter">

        <textarea name="title" from="basetextarea">
            <area>20,50,770,30</area>
            <value>Filter/sort images</value>
            <align>hcenter,vcenter</align>
            <font>baselarge</font>
        </textarea>

        <!-- Filter: labels -->
        <textarea name="filter_text" from="basetextarea">
            <area>10,107,180,34</area>
            <value>Directory filter :</value>
            <align>right,top</align>
        </textarea>

        <textarea name="type_filter" from="filter_text">
            <position>10,161</position>
            <value>Type filter :</value>
        </textarea>

        <textarea name="numimages_text" from="basetextarea">
            <area>200,255,770,30</area>
            <value>NumImages_Text</value>
            <align>left,top</align>
        </textarea>

        <!-- Sort: labels -->
        <textarea name="sort_text" from="basetextarea">
            <area>10,319,180,34</area>
            <value>Sort by :</value>
            <align>right,top</align>
        </textarea>

        <!-- Widgets -->
        <textedit name="dirfilter_text" from="basetextedit">
            <position>200,100</position>
        </textedit>

        <buttonlist name="typefilter_select" from="baseselector">
            <position>200,154</position>
        </buttonlist>

        <button name="check_button" from="basebutton">
            <position>200,200</position>
            <value>Check Filter</value>
        </button>

        <buttonlist name="sort_select" from="baseselector">
            <position>200,312</position>
        </buttonlist>

        <button name="done_button" from="basebutton">
            <position>380,505</position>
            <value>Done</value>
        </button>

        <button name="save_button" from="basebutton">
            <position>200,505</position>
            <value>Save as default</value>
        </button>

    </window>
</mythuitheme>
