<?xml version="1.0" encoding="utf-8"?>
<!DOCTYPE mythuitheme SYSTEM "http://www.mythtv.org/schema/mythuitheme.dtd">
<mythuitheme>

    <window name="keygrabpopup">
        <area>390,150,500,500</area>
        <shape name="backimg" from="basepopupbackground">
            <area>0,0,100%,100%</area>
        </shape>

        <textarea name="message" from="basetextarea">
            <area>18,18,460,400</area>
            <multiline>yes</multiline>
        </textarea>

        <button name="cancel" from="basebutton">
            <position>84,420</position>
            <value>Cancel</value>
        </button>

        <button name="ok" from="basebutton">
            <position>264,420</position>
            <value>OK</value>
        </button>
    </window>

    <window name="controls">

        <textarea name="leftdesc" from="basetextarea">
            <area>64,46,560,30</area>
            <value>Contexts</value>
            <align>center</align>
        </textarea>

        <buttonlist name="leftlist" from="basebuttonlist">
            <area>64,86,560,440</area>
            <showarrow>no</showarrow>
        </buttonlist>

        <textarea name="rightdesc" from="leftdesc">
            <area>656,46,560,30</area>
            <value>Actions</value>
        </textarea>

        <buttonlist name="rightlist" from="leftlist">
            <area>656,86,560,440</area>
        </buttonlist>

        <button name="action_0" from="basebutton">
            <position>274,560</position>
        </button>

        <button name="action_1" from="action_0">
            <position>464,560</position>
        </button>

        <button name="action_2" from="action_0">
            <position>654,560</position>
        </button>

        <button name="action_3" from="action_0">
            <position>844,560</position>
        </button>

        <textarea name="description" from="basetextarea">
            <area>64,600,1152,90</area>
            <multiline>yes</multiline>
            <align>center</align>
        </textarea>

    </window>
</mythuitheme>
